{
  "$schema": "../../schema/scenario.schema.json",
  "id": "d02",
  "slug": "d02-uat-region-total",
  "type": "drill",
  "stage": "analyst",
  "order": 4,
  "title": "\"The Region total doesn't match Excel\"",
  "seo": "Power BI user acceptance testing drill: a tester reports that region totals don't match Excel. Reproduce, compare definitions and decide whether it's a defect or a requirement mismatch.",
  "summary": "Nina's UAT finding says the report's region totals don't match her Excel. Reproduce it, explain it and decide: defect or requirement mismatch?",
  "minutes": 60,
  "skills": ["testing", "modeling", "communication"],
  "prereq": ["s01"],
  "ticket": { "id": "UAT-017", "kind": "uat", "priority": "Normal", "reporter": "nina", "opened": "Tue 21 Apr 2026, 15:40", "labels": ["uat", "regions"] },
  "impact": "UAT is where the business decides whether to trust a report. Calling a definition difference a \"bug\" (or a real bug \"by design\") loses that trust for months.",
  "messages": [
    { "from": "nina", "to": "you", "via": "email", "at": "Tue 21 Apr, 15:40", "subject": "UAT-017: Region totals wrong", "body": [
      "Hi, testing the Q1 dashboard: West shows {{uat_sales_west|money0}} but my Excel says {{uat_home_west|money0}}. Central is the other way round. Europe matches. Total matches. Logged as a defect, severity high. Screenshot and my Excel attached."
    ] }
  ],
  "evidence": [
    { "id": "xl", "kind": "file", "title": "nina_excel_region_totals.csv", "file": "data/experience/d02/nina_excel_region_totals.csv" },
    { "id": "rep", "kind": "file", "title": "report_region_totals.csv", "file": "data/experience/d02/report_region_totals.csv" },
    { "id": "wiki", "kind": "doc", "title": "Sales terminology (team wiki)", "body": ["**Regions**: Sales are credited to the region of the store or rep that made the sale."] },
    { "id": "orders", "kind": "file", "title": "orders.csv", "file": "data/experience/company/orders.csv" },
    { "id": "customers", "kind": "file", "title": "customers.csv", "file": "data/experience/company/customers.csv" }
  ],
  "tasks": ["Reproduce both numbers from the data.", "Explain the difference in one sentence.", "Decide: defect, requirement mismatch, or test error, and record the UAT outcome.", "Propose what the report should do so testers don't trip over it again."],
  "deliverables": [{ "id": "uat", "t": "UAT log entry: test case, expected, actual, evidence, status, owner, notes", "artifact": "uat-plan" }, { "id": "reply", "t": "Reply to Nina" }],
  "hints": ["Totals match and Europe matches; only US regions move between each other. Which two region columns exist, and which one did each side use?", "Count orders where the sales region differs from the customer's home region."],
  "rubric": [
    { "id": "repro", "n": "Reproduction", "w": 30, "good": "Both sets of numbers rebuilt from the data, to the dollar." },
    { "id": "class", "n": "Classification", "w": 30, "good": "Correctly classified as a requirement mismatch (two valid definitions), with the wiki as evidence." },
    { "id": "doc", "n": "UAT documentation", "w": 20, "good": "Log entry complete: expected, actual, evidence, status, owner." },
    { "id": "comm", "n": "Communication", "w": 20, "good": "Nina's work is respected; the report gets a clearer label or a second view." }
  ],
  "retro": ["How would the report's design have prevented this finding?"],
  "refs": [{ "title": "Active vs inactive relationship guidance", "url": "https://learn.microsoft.com/en-us/power-bi/guidance/relationships-active-inactive" }]
}
